======================================================================================================================
DESCRIPTION:

MB-39505: Use linear buckets for exposing histograms to Prometheus

Percentile based iteration of HdrHistograms provides valuable detail,
but does not lead to consistent bucket bounds and is therefore
unacceptable for Prometheus.

Buckets changing over time leads to a large number of Prometheus time
series, and leads to problems when querying.

Furthermore, percentiles do not necessarily lead to unique bucket
bounds. This leads to a single prometheus scrape finding multiple
results for the same apparent lower bound (as encountered in MB-41728).

Change-Id: Ib6a42478a79500506e64dc9b96e5bcc6407080ca

======================================================================================================================
COMMENTS
======================================================================================================================
Author: James H
Date: 2020-10-16 10:32:54.000000000
Message: 
Uploaded patch set 1.
----------------------------------------------------------------------------------------------------------------------
Author: Richard de Mellow
Date: 2020-10-16 11:08:01.000000000
Message: 
Patch Set 1: Code-Review-1

(5 comments)

(soft -1)
Line:11, /COMMIT_MSG -> lol 😄 https://giphy.com/gifs/mumbles-man-im-so-rusty-pillars-of-eternity-3eKdC7REvgOt2

Line:96, statistics/cbstat_collector.cc -> auto iter = v.getHistogramsIterator(); would probs be cleaner here

Line:56, statistics/prometheus_collector.cc -> If there's no values in the histogram why create the iterator?

Line:61, statistics/prometheus_collector.cc -> could use uint64_t/auto here given the compiler will auto promote to double (given line 62) https://en.cppreference.com/w/cpp/language/operator_arithmetic

Line:65, statistics/prometheus_collector.cc -> could use auto here to make things a little cleaner.

----------------------------------------------------------------------------------------------------------------------
Author: Richard de Mellow
Date: 2020-10-16 11:09:39.000000000
Message: 
Patch Set 1:

(1 comment)
Line:61, statistics/prometheus_collector.cc -> btw no need to change more fyi

----------------------------------------------------------------------------------------------------------------------
Author: Build Bot
Date: 2020-10-16 11:18:41.000000000
Message: 
Patch Set 1: Verified-1

Build Failed 

http://cv.jenkins.couchbase.com/job/kv_engine-clang_tidy/5086/ : FAILURE

Compile error at /usr/local/bin/../lib/gcc/x86_64-pc-linux-gnu/7.3.0/../../../../include/c++/7.3.0/type_traits:1409:4:
error: incomplete type "CollectionID" used in type trait expression [clang-diagnostic-error]
 ( http://cv.jenkins.couchbase.com/job/kv_engine-clang_tidy/5086/ )

http://cv.jenkins.couchbase.com/job/kv_engine-windows-master/31147/ : FAILURE

Compile error at C:\Jenkins\workspace\kv_engine-windows-master\kv_engine\include\statistics/prometheus.h(39): error C2039: "function": is not a member of "std" ( http://cv.jenkins.couchbase.com/job/kv_engine-windows-master/31147/ )

http://cv.jenkins.couchbase.com/job/kv_engine.linux-CE/job/master/6400/ : FAILURE

Failure of a CTest test [2020-10-16T10:44:32.322Z] 130/397 Test #143: ep-engine_ep_unit_tests.CollectionsEphemeralOrPersistent/CollectionsParameterizedTest ....................... ( http://cv.jenkins.couchbase.com/job/kv_engine.linux-CE/job/master/6400/ )

http://cv.jenkins.couchbase.com/job/kv_engine.macos/job/master/5478/ : FAILURE

Failure of a CTest test [2020-10-16T10:48:38.776Z]  93/407 Test #142: ep-engine_ep_unit_tests.CollectionsEphemeralOrPersistent/CollectionsParameterizedTest ....................... ( http://cv.jenkins.couchbase.com/job/kv_engine.macos/job/master/5478/ )

http://cv.jenkins.couchbase.com/job/kv_engine.linux/job/master/6520/ : FAILURE

Failure of a CTest test [2020-10-16T10:59:06.782Z]  31/410 Test #145: ep-engine_ep_unit_tests.CollectionsEphemeralOrPersistent/CollectionsParameterizedTest ....................... ( http://cv.jenkins.couchbase.com/job/kv_engine.linux/job/master/6520/ )

http://cv.jenkins.couchbase.com/job/kv_engine.ASan-UBSan/job/master/14310/ : FAILURE

http://cv.jenkins.couchbase.com/job/kv_engine.threadsanitizer/job/master/6672/ : FAILURE

Failure of an engine_testapp test:

<pre>
Running [0007/0047]: multi set...Exceeded maximum wait time of 60000000us waiting for stat "ep_queue_size" to be 0 (last value:7898) - aborting.
</pre>
 ( http://cv.jenkins.couchbase.com/job/kv_engine.threadsanitizer/job/master/6672/ )

ThreadSanitizer issue: data race ../kv_engine/engines/ep/src/ep_engine.cc:4570 in EventuallyPersistentEngine::getStats(void const*, std::basic_string_view<char, std::char_traits<char> >, std::basic_string_view<char, std::char_traits<char> >, std::function<void (std::basic_string_view<char, std::char_traits<char> >, std::basic_string_view<char, std::char_traits<char> >, gsl::not_null<void const*>)> const&)  ( http://cv.jenkins.couchbase.com/job/kv_engine.threadsanitizer/job/master/6672/ )

Failure of a CTest test [2020-10-16T11:10:33.844Z]  13/388 Test #241: ep_testsuite_basic.value_eviction.magma .....................................................................Child aborted ( http://cv.jenkins.couchbase.com/job/kv_engine.threadsanitizer/job/master/6672/ )

http://cv.jenkins.couchbase.com/job/kv_engine-clang_format_9/3616/ : SUCCESS

http://cv.jenkins.couchbase.com/job/kv_engine-clang_analyzer-master/26885/ : SUCCESS
----------------------------------------------------------------------------------------------------------------------
Author: James H
Date: 2020-10-16 12:00:48.000000000
Message: 
Patch Set 1:

(5 comments)
Line:11, /COMMIT_MSG -> :indeed: 😄

Line:96, statistics/cbstat_collector.cc -> This was from all the way back to the original add_casted_histo stat setup :ohwow: - I'll tidy the assignment in a follow up as this method def is just moved from StatCollector 😊

Line:56, statistics/prometheus_collector.cc -> It was _originally_ in the hope that it would iterate empty buckets if linear iteration is used - it does not.

Will shuffle to avoid the iterator, but for prometheus the addStat does need to occur even if there's no values, to ensure the count and sum are present even if they're zero.

Line:61, statistics/prometheus_collector.cc -> Removed the double on 62, and kept this one 😊

Line:65, statistics/prometheus_collector.cc -> Done - changing this one because this method isn't a straight copy paste of the original

----------------------------------------------------------------------------------------------------------------------
Author: Richard de Mellow
Date: 2020-10-16 12:08:55.000000000
MISMATCHED INLINE COMMENT
Line:61, statistics/prometheus_collector.cc -> Done
----------------------------------------------------------------------------------------------------------------------
Author: Richard de Mellow
Date: 2020-10-16 12:08:55.000000000
MISMATCHED INLINE COMMENT
Line:65, statistics/prometheus_collector.cc -> Done
----------------------------------------------------------------------------------------------------------------------
